{
  "formatVersion": 1,
  "id": "peroneals-smr",
  "name": "Peroneals-SMR",
  "aliases": [],
  "category": "stretching",
  "level": "intermediate",
  "force": "static",
  "mechanic": null,
  "equipment": "foam roll",
  "primaryMuscles": [
    "calves"
  ],
  "secondaryMuscles": [],
  "instructions": [
    "Lay on your side, supporting your weight on your forearm and on a foam roller placed on the outside of your lower leg. Your upper leg can either be on top of your lower leg, or you can cross it in front of you. This will be your starting position.",
    "Raise your hips off of the ground and begin to roll from below the knee to above the ankle on the side of your leg, pausing at points of tension for 10-30 seconds. Repeat on the other leg."
  ],
  "images": [
    "images/peroneals-smr/0.webp",
    "images/peroneals-smr/1.webp"
  ],
  "source": {
    "name": "free-exercise-db",
    "id": "Peroneals-SMR"
  }
}
