{
  "formatVersion": 1,
  "id": "leg-up-hamstring-stretch",
  "name": "Leg-Up Hamstring Stretch",
  "aliases": [],
  "category": "stretching",
  "level": "beginner",
  "force": "push",
  "mechanic": "isolation",
  "equipment": null,
  "primaryMuscles": [
    "hamstrings"
  ],
  "secondaryMuscles": [],
  "instructions": [
    "Lie flat on your back, bend one knee, and put that foot flat on the floor to stabilize your spine.",
    "Extend the other leg in the air. If you're tight, you wont be able to straighten it. That's okay. Extend the knee so that the sole of the lifted foot faces the ceiling (or as close as you can get it).",
    "Slowly straighten the legs as much as possible and then pull the leg toward your nose. Switch sides."
  ],
  "images": [
    "images/leg-up-hamstring-stretch/0.webp",
    "images/leg-up-hamstring-stretch/1.webp"
  ],
  "source": {
    "name": "free-exercise-db",
    "id": "Leg-Up_Hamstring_Stretch"
  }
}
