{
  "formatVersion": 1,
  "id": "box-jump-multiple-response",
  "name": "Box Jump (Multiple Response)",
  "aliases": [],
  "category": "plyometrics",
  "level": "beginner",
  "force": "push",
  "mechanic": "compound",
  "equipment": "other",
  "primaryMuscles": [
    "hamstrings"
  ],
  "secondaryMuscles": [
    "abductors",
    "adductors",
    "calves",
    "glutes",
    "quadriceps"
  ],
  "instructions": [
    "Assume a relaxed stance facing the box or platform approximately an arm's length away. Arms should be down at the sides and legs slightly bent.",
    "Using the arms to aid in the initial burst, jump upward and forward, landing with feet simultaneously on top of the box or platform.",
    "Immediately drop or jump back down to the original starting place; then repeat the sequence."
  ],
  "images": [
    "images/box-jump-multiple-response/0.webp",
    "images/box-jump-multiple-response/1.webp"
  ],
  "source": {
    "name": "free-exercise-db",
    "id": "Box_Jump_Multiple_Response"
  }
}
