{
  "formatVersion": 1,
  "id": "looking-at-ceiling",
  "name": "Looking At Ceiling",
  "aliases": [],
  "category": "stretching",
  "level": "beginner",
  "force": "static",
  "mechanic": "isolation",
  "equipment": null,
  "primaryMuscles": [
    "quadriceps"
  ],
  "secondaryMuscles": [],
  "instructions": [
    "Kneel on the floor, holding your heels with both hands.",
    "Lift your buttocks up and forward while bringing your head back to look up at the ceiling, to give an arch in your back."
  ],
  "images": [
    "images/looking-at-ceiling/0.webp",
    "images/looking-at-ceiling/1.webp"
  ],
  "source": {
    "name": "free-exercise-db",
    "id": "Looking_At_Ceiling"
  }
}
