{
  "formatVersion": 1,
  "id": "wide-grip-barbell-bench-press",
  "name": "Wide-Grip Barbell Bench Press",
  "aliases": [],
  "category": "strength",
  "level": "intermediate",
  "force": "push",
  "mechanic": "compound",
  "equipment": "barbell",
  "primaryMuscles": [
    "chest"
  ],
  "secondaryMuscles": [
    "shoulders",
    "triceps"
  ],
  "instructions": [
    "Lie back on a flat bench with feet firm on the floor. Using a wide, pronated (palms forward) grip that is around 3 inches away from shoulder width (for each hand), lift the bar from the rack and hold it straight over you with your arms locked. The bar will be perpendicular to the torso and the floor. This will be your starting position.",
    "As you breathe in, come down slowly until you feel the bar on your middle chest.",
    "After a second pause, bring the bar back to the starting position as you breathe out and push the bar using your chest muscles. Lock your arms and squeeze your chest in the contracted position, hold for a second and then start coming down slowly again. Tip: It should take at least twice as long to go down than to come up.",
    "Repeat the movement for the prescribed amount of repetitions."
  ],
  "images": [
    "images/wide-grip-barbell-bench-press/0.webp",
    "images/wide-grip-barbell-bench-press/1.webp"
  ],
  "source": {
    "name": "free-exercise-db",
    "id": "Wide-Grip_Barbell_Bench_Press"
  }
}
