{
  "formatVersion": 1,
  "id": "pullups",
  "name": "Pullups",
  "aliases": [
    "pull-up",
    "pull up",
    "pull-ups"
  ],
  "category": "strength",
  "level": "beginner",
  "force": "pull",
  "mechanic": "compound",
  "equipment": "body only",
  "primaryMuscles": [
    "lats"
  ],
  "secondaryMuscles": [
    "biceps",
    "middle back"
  ],
  "instructions": [
    "Grab the pull-up bar with the palms facing forward using the prescribed grip. Note on grips: For a wide grip, your hands need to be spaced out at a distance wider than your shoulder width. For a medium grip, your hands need to be spaced out at a distance equal to your shoulder width and for a close grip at a distance smaller than your shoulder width.",
    "As you have both arms extended in front of you holding the bar at the chosen grip width, bring your torso back around 30 degrees or so while creating a curvature on your lower back and sticking your chest out. This is your starting position.",
    "Pull your torso up until the bar touches your upper chest by drawing the shoulders and the upper arms down and back. Exhale as you perform this portion of the movement. Tip: Concentrate on squeezing the back muscles once you reach the full contracted position. The upper torso should remain stationary as it moves through space and only the arms should move. The forearms should do no other work other than hold the bar.",
    "After a second on the contracted position, start to inhale and slowly lower your torso back to the starting position when your arms are fully extended and the lats are fully stretched.",
    "Repeat this motion for the prescribed amount of repetitions."
  ],
  "images": [
    "images/pullups/0.webp",
    "images/pullups/1.webp"
  ],
  "source": {
    "name": "free-exercise-db",
    "id": "Pullups"
  }
}
