{
  "formatVersion": 1,
  "id": "rope-jumping",
  "name": "Rope Jumping",
  "aliases": [],
  "category": "cardio",
  "level": "intermediate",
  "force": null,
  "mechanic": null,
  "equipment": "other",
  "primaryMuscles": [
    "quadriceps"
  ],
  "secondaryMuscles": [
    "calves",
    "hamstrings"
  ],
  "instructions": [
    "Hold an end of the rope in each hand. Position the rope behind you on the ground. Raise your arms up and turn the rope over your head bringing it down in front of you. When it reaches the ground, jump over it. Find a good turning pace that can be maintained. Different speeds and techniques can be used to introduce variation.",
    "Rope jumping is exciting, challenges your coordination, and requires a lot of energy. A 150 lb person will burn about 350 calories jumping rope for 30 minutes, compared to over 450 calories running."
  ],
  "images": [
    "images/rope-jumping/0.webp",
    "images/rope-jumping/1.webp"
  ],
  "source": {
    "name": "free-exercise-db",
    "id": "Rope_Jumping"
  }
}
