{
  "formatVersion": 1,
  "id": "quadriceps-smr",
  "name": "Quadriceps-SMR",
  "aliases": [],
  "category": "stretching",
  "level": "intermediate",
  "force": "static",
  "mechanic": "isolation",
  "equipment": "foam roll",
  "primaryMuscles": [
    "quadriceps"
  ],
  "secondaryMuscles": [],
  "instructions": [
    "Lay facedown on the floor with your weight supported by your hands or forearms. Place a foam roll underneath one leg on the quadriceps, and keep the foot off of the ground. Make sure to relax the leg as much as possible. This will be your starting position.",
    "Shifting as much weight onto the leg to be stretched as is tolerable, roll over the foam from above the knee to below the hip, holding points of tension for 10-30 seconds. Switch sides."
  ],
  "images": [
    "images/quadriceps-smr/0.webp",
    "images/quadriceps-smr/1.webp"
  ],
  "source": {
    "name": "free-exercise-db",
    "id": "Quadriceps-SMR"
  }
}
